{
  "schema_version": "folioloom_figma_spec_v1",
  "spec_id": "glossary_review_panel",
  "title": "FolioLoom synthetic glossary review panel",
  "metadata": {
    "product_context": "CAT workbench prototype",
    "fixture_type": "synthetic UI coverage",
    "generated_for": "Phase A local Figma paste renderer"
  },
  "pages": [
    {
      "id": "glossary_page",
      "name": "Glossary review",
      "children": [
        {
          "id": "review_shell",
          "type": "frame",
          "name": "Glossary review shell",
          "x": 0,
          "y": 0,
          "width": 980,
          "height": 660,
          "fill": "#F7F8FA",
          "children": [
            { "id": "panel_title", "type": "text", "x": 40, "y": 34, "width": 560, "height": 38, "text": "Glossary review", "fontSize": 28, "fontWeight": "semibold", "color": "#172033" },
            { "id": "panel_subtitle", "type": "text", "x": 42, "y": 82, "width": 680, "height": 28, "text": "Synthetic approval workflow before translation draft generation.", "fontSize": 14, "color": "#586174" },
            { "id": "search_input", "type": "input", "x": 40, "y": 140, "width": 420, "height": 46, "text": "Filter terms", "fontSize": 14, "fill": "#FFFFFF", "stroke": "#CBD5E1", "strokeWidth": 1, "color": "#64748B", "cornerRadius": 12 },
            { "id": "approved_chip", "type": "chip", "x": 482, "y": 146, "width": 142, "height": 34, "text": "18 approved", "fontSize": 12, "fill": "#E8F6EE", "stroke": "#BEE5CB", "color": "#156B3A", "cornerRadius": 17 },
            { "id": "pending_chip", "type": "chip", "x": 640, "y": 146, "width": 132, "height": 34, "text": "6 pending", "fontSize": 12, "fill": "#FFF6E5", "stroke": "#F8D591", "color": "#8A5200", "cornerRadius": 17 },
            { "id": "term_card_one", "type": "card", "x": 40, "y": 220, "width": 900, "height": 96, "fill": "#FFFFFF", "stroke": "#D9DEE8", "strokeWidth": 1, "cornerRadius": 16, "children": [
              { "id": "term_one_source", "type": "text", "x": 24, "y": 22, "width": 260, "height": 24, "text": "source term alpha", "fontSize": 16, "fontWeight": "semibold", "color": "#111827" },
              { "id": "term_one_target", "type": "text", "x": 330, "y": 22, "width": 260, "height": 24, "text": "approved target alpha", "fontSize": 16, "color": "#203252" },
              { "id": "term_one_status", "type": "chip", "x": 720, "y": 20, "width": 112, "height": 30, "text": "Locked", "fontSize": 12, "fill": "#EBF2FF", "stroke": "#BDD3FF", "color": "#214E9D", "cornerRadius": 15 }
            ] },
            { "id": "term_card_two", "type": "card", "x": 40, "y": 340, "width": 900, "height": 96, "fill": "#FFFFFF", "stroke": "#D9DEE8", "strokeWidth": 1, "cornerRadius": 16, "children": [
              { "id": "term_two_source", "type": "text", "x": 24, "y": 22, "width": 260, "height": 24, "text": "source term beta", "fontSize": 16, "fontWeight": "semibold", "color": "#111827" },
              { "id": "term_two_target", "type": "text", "x": 330, "y": 22, "width": 260, "height": 24, "text": "candidate target beta", "fontSize": 16, "color": "#203252" },
              { "id": "term_two_button", "type": "button", "x": 706, "y": 20, "width": 126, "height": 34, "text": "Approve", "fontSize": 12, "fill": "#172033", "color": "#FFFFFF", "cornerRadius": 12 }
            ] },
            { "id": "term_card_three", "type": "card", "x": 40, "y": 460, "width": 900, "height": 96, "fill": "#FFFFFF", "stroke": "#D9DEE8", "strokeWidth": 1, "cornerRadius": 16, "children": [
              { "id": "term_three_source", "type": "text", "x": 24, "y": 22, "width": 260, "height": 24, "text": "source term gamma", "fontSize": 16, "fontWeight": "semibold", "color": "#111827" },
              { "id": "term_three_target", "type": "text", "x": 330, "y": 22, "width": 260, "height": 24, "text": "needs reviewer choice", "fontSize": 16, "color": "#203252" },
              { "id": "term_three_status", "type": "chip", "x": 710, "y": 20, "width": 122, "height": 30, "text": "Needs review", "fontSize": 12, "fill": "#FFF6E5", "stroke": "#F8D591", "color": "#8A5200", "cornerRadius": 15 }
            ] }
          ]
        }
      ]
    }
  ]
}
